{
  "schema_version": 2,
  "source_kind": "nvapi_cooler_status_v1_observation",
  "profile_name": "gpuz-2.70.0-nvapi-610.88-cooler-status-v1",
  "capture_started_utc": "2026-08-27T20:00:00Z",
  "captured_utc": "2026-08-27T20:00:10Z",
  "duration_seconds": 10,
  "process_id": 1234,
  "gpuz_sha256": "6cb0ef29682452de81a9576808881685161411a1fad00938ba04131159979c29",
  "debugger_sha256": "1111111111111111111111111111111111111111111111111111111111111111",
  "debugger_file_version": "1.0.0.0",
  "gpu_profile": {
    "gpu_index": 0,
    "gpu_name": "NVIDIA GeForce RTX 3060",
    "gpu_uuid": "GPU-11111111-2222-3333-4444-555555555555",
    "driver_version": "610.88",
    "nvml_version": "13.610.88",
    "pci_bus_id": "00000000:01:00.0",
    "pci_vendor_id": "0x10de",
    "pci_device_id": "0x2504",
    "pci_subsystem_vendor_id": "0x10de",
    "pci_subsystem_device_id": "0x1536",
    "vbios_version": "94.06.25.00.fc"
  },
  "identity_probe_sha256": "4444444444444444444444444444444444444444444444444444444444444444",
  "candidate_inventory_sha256": "3aaada9b367dacca7cf74511bae8532bd79b7f8bd06b9bb609056f3d9da1f1d7",
  "prior_observation_sha256": "f580f67da61df2287257fb023fe277d310fdf424f588bbd96d01ac01433f8de2",
  "nvapi_module_sha256": "fbc9aed43bfa5bda19b7f83a809a081a0ce454b6d6003dcabc565ecb3e6afdaf",
  "loaded_nvapi_module": {
    "file_name": "nvapi_impl.dll",
    "file_sha256": "fbc9aed43bfa5bda19b7f83a809a081a0ce454b6d6003dcabc565ecb3e6afdaf",
    "start_address": "0x61e80000",
    "end_address": "0x62375000",
    "proof_source": "cdb_modload_target_image"
  },
  "interface_id": "0x35aed5e8",
  "function_rva": "0x001b9f10",
  "caller_module_name": "GPU-Z.exe",
  "caller_rvas": [
    "0x0021d654",
    "0x0021d824"
  ],
  "capture_point": "post_call_return",
  "buffer_pointer_expression": "poi(@esp+4)",
  "return_status_register": "eax",
  "structure_version": "0x000106a8",
  "structure_size_bytes": 1704,
  "structure_word_count": 426,
  "count_byte_offset": 4,
  "entry_base_offset": 40,
  "entry_stride_bytes": 52,
  "entry_capacity": 32,
  "raw_field_byte_offsets_within_entry": [
    4,
    8,
    12,
    16
  ],
  "reference_log": {
    "size_bytes_before": 100,
    "size_bytes_midpoint": 200,
    "size_bytes_after": 300,
    "last_write_utc_before": "2026-08-27T20:00:00Z",
    "last_write_utc_midpoint": "2026-08-27T20:00:05Z",
    "last_write_utc_after": "2026-08-27T20:00:10Z",
    "last_sample_local_before": "2026-08-27 17:00:00",
    "last_sample_local_midpoint": "2026-08-27 17:00:05",
    "last_sample_local_after": "2026-08-27 17:00:10",
    "grew_during_capture": true
  },
  "call_count": 2,
  "call_sites": [
    {
      "caller_rva": "0x0021d654",
      "call_count": 1
    },
    {
      "caller_rva": "0x0021d824",
      "call_count": 1
    }
  ],
  "samples": [
    {
      "sequence": 1,
      "thread_id": "0x00000001",
      "caller_rva": "0x0021d654",
      "return_status": "0x00000000",
      "buffer_address": "0x0813efac",
      "structure_version": "0x000106a8",
      "observed_count": 2,
      "raw_words": [
        "0x000106a8",
        "0x00000002",
        "0x00000000",
        "0x00000000",
        "0x00000000",
        "0x00000000",
        "0x00000000",
        "0x00000000",
        "0x00000000",
        "0x00000000",
        "0x00000001",
        "0x10000001",
        "0x20000001",
        "0x30000001",
        "0x40000001",
        "0x00000000",
        "0x00000000",
        "0x00000000",
        "0x00000000",
        "0x00000000",
        "0x00000000",
        "0x00000000",
        "0x00000000",
        "0x00000002",
        "0x50000001",
        "0x60000001",
        "0x70000001",
        "0x01000001",
        "0x00000000",
        "0x00000000",
        "0x00000000",
        "0x00000000",
        "0x00000000",
        "0x00000000",
        "0x00000000",
        "0x00000000",
        "0x00000000",
        "0x00000000",
        "0x00000000",
        "0x00000000",
        "0x00000000",
        "0x00000000",
        "0x00000000",
        "0x00000000",
        "0x00000000",
        "0x00000000",
        "0x00000000",
        "0x00000000",
        "0x00000000",
        "0x00000000",
        "0x00000000",
        "0x00000000",
        "0x00000000",
        "0x00000000",
        "0x00000000",
        "0x00000000",
        "0x00000000",
        "0x00000000",
        "0x00000000",
        "0x00000000",
        "0x00000000",
        "0x00000000",
        "0x00000000",
        "0x00000000",
        "0x00000000",
        "0x00000000",
        "0x00000000",
        "0x00000000",
        "0x00000000",
        "0x00000000",
        "0x00000000",
        "0x00000000",
        "0x00000000",
        "0x00000000",
        "0x00000000",
        "0x00000000",
        "0x00000000",
        "0x00000000",
        "0x00000000",
        "0x00000000",
        "0x00000000",
        "0x00000000",
        "0x00000000",
        "0x00000000",
        "0x00000000",
        "0x00000000",
        "0x00000000",
        "0x00000000",
        "0x00000000",
        "0x00000000",
        "0x00000000",
        "0x00000000",
        "0x00000000",
        "0x00000000",
        "0x00000000",
        "0x00000000",
        "0x00000000",
        "0x00000000",
        "0x00000000",
        "0x00000000",
        "0x00000000",
        "0x00000000",
        "0x00000000",
        "0x00000000",
        "0x00000000",
        "0x00000000",
        "0x00000000",
        "0x00000000",
        "0x00000000",
        "0x00000000",
        "0x00000000",
        "0x00000000",
        "0x00000000",
        "0x00000000",
        "0x00000000",
        "0x00000000",
        "0x00000000",
        "0x00000000",
        "0x00000000",
        "0x00000000",
        "0x00000000",
        "0x00000000",
        "0x00000000",
        "0x00000000",
        "0x00000000",
        "0x00000000",
        "0x00000000",
        "0x00000000",
        "0x00000000",
        "0x00000000",
        "0x00000000",
        "0x00000000",
        "0x00000000",
        "0x00000000",
        "0x00000000",
        "0x00000000",
        "0x00000000",
        "0x00000000",
        "0x00000000",
        "0x00000000",
        "0x00000000",
        "0x00000000",
        "0x00000000",
        "0x00000000",
        "0x00000000",
        "0x00000000",
        "0x00000000",
        "0x00000000",
        "0x00000000",
        "0x00000000",
        "0x00000000",
        "0x00000000",
        "0x00000000",
        "0x00000000",
        "0x00000000",
        "0x00000000",
        "0x00000000",
        "0x00000000",
        "0x00000000",
        "0x00000000",
        "0x00000000",
        "0x00000000",
        "0x00000000",
        "0x00000000",
        "0x00000000",
        "0x00000000",
        "0x00000000",
        "0x00000000",
        "0x00000000",
        "0x00000000",
        "0x00000000",
        "0x00000000",
        "0x00000000",
        "0x00000000",
        "0x00000000",
        "0x00000000",
        "0x00000000",
        "0x00000000",
        "0x00000000",
        "0x00000000",
        "0x00000000",
        "0x00000000",
        "0x00000000",
        "0x00000000",
        "0x00000000",
        "0x00000000",
        "0x00000000",
        "0x00000000",
        "0x00000000",
        "0x00000000",
        "0x00000000",
        "0x00000000",
        "0x00000000",
        "0x00000000",
        "0x00000000",
        "0x00000000",
        "0x00000000",
        "0x00000000",
        "0x00000000",
        "0x00000000",
        "0x00000000",
        "0x00000000",
        "0x00000000",
        "0x00000000",
        "0x00000000",
        "0x00000000",
        "0x00000000",
        "0x00000000",
        "0x00000000",
        "0x00000000",
        "0x00000000",
        "0x00000000",
        "0x00000000",
        "0x00000000",
        "0x00000000",
        "0x00000000",
        "0x00000000",
        "0x00000000",
        "0x00000000",
        "0x00000000",
        "0x00000000",
        "0x00000000",
        "0x00000000",
        "0x00000000",
        "0x00000000",
        "0x00000000",
        "0x00000000",
        "0x00000000",
        "0x00000000",
        "0x00000000",
        "0x00000000",
        "0x00000000",
        "0x00000000",
        "0x00000000",
        "0x00000000",
        "0x00000000",
        "0x00000000",
        "0x00000000",
        "0x00000000",
        "0x00000000",
        "0x00000000",
        "0x00000000",
        "0x00000000",
        "0x00000000",
        "0x00000000",
        "0x00000000",
        "0x00000000",
        "0x00000000",
        "0x00000000",
        "0x00000000",
        "0x00000000",
        "0x00000000",
        "0x00000000",
        "0x00000000",
        "0x00000000",
        "0x00000000",
        "0x00000000",
        "0x00000000",
        "0x00000000",
        "0x00000000",
        "0x00000000",
        "0x00000000",
        "0x00000000",
        "0x00000000",
        "0x00000000",
        "0x00000000",
        "0x00000000",
        "0x00000000",
        "0x00000000",
        "0x00000000",
        "0x00000000",
        "0x00000000",
        "0x00000000",
        "0x00000000",
        "0x00000000",
        "0x00000000",
        "0x00000000",
        "0x00000000",
        "0x00000000",
        "0x00000000",
        "0x00000000",
        "0x00000000",
        "0x00000000",
        "0x00000000",
        "0x00000000",
        "0x00000000",
        "0x00000000",
        "0x00000000",
        "0x00000000",
        "0x00000000",
        "0x00000000",
        "0x00000000",
        "0x00000000",
        "0x00000000",
        "0x00000000",
        "0x00000000",
        "0x00000000",
        "0x00000000",
        "0x00000000",
        "0x00000000",
        "0x00000000",
        "0x00000000",
        "0x00000000",
        "0x00000000",
        "0x00000000",
        "0x00000000",
        "0x00000000",
        "0x00000000",
        "0x00000000",
        "0x00000000",
        "0x00000000",
        "0x00000000",
        "0x00000000",
        "0x00000000",
        "0x00000000",